{
  "$schema":"https://json-schema.org/draft/2020-12/schema","$id":"https://example.invalid/aica/schemas/assessment-diff.schema.json","title":"Assessment Diff","type":"object","required":["from_run_id","to_run_id","generated_at","summary","resolved","regressed","new","stale","errored","status_changes","risk_changes"],"properties":{"$schema":{"type":"string"},"from_run_id":{"type":"string","format":"uuid"},"to_run_id":{"type":"string","format":"uuid"},"generated_at":{"type":"string","format":"date-time"},"summary":{"type":"object","required":["resolved","regressed","new","unchanged","not_applicable","stale","errored"],"additionalProperties":{"type":"integer","minimum":0}},"resolved":{"type":"array","items":{"$ref":"#/$defs/objectiveChange"}},"regressed":{"type":"array","items":{"$ref":"#/$defs/objectiveChange"}},"new":{"type":"array","items":{"$ref":"#/$defs/objectiveChange"}},"stale":{"type":"array","items":{"type":"object"}},"errored":{"type":"array","items":{"type":"object"}},"status_changes":{"type":"array","items":{"type":"object"}},"risk_changes":{"type":"array","items":{"type":"object"}}},"$defs":{"objectiveChange":{"type":"object","required":["objective_id","from_status","to_status","from_result_ref","to_result_ref"],"properties":{"objective_id":{"type":"string"},"from_status":{"type":["string","null"]},"to_status":{"type":["string","null"]},"from_result_ref":{"type":["string","null"]},"to_result_ref":{"type":["string","null"]},"finding_ref":{"type":["string","null"]},"retest_ref":{"type":["string","null"]}}}}
}
